{
  "diagnostics": [],
  "edges": [],
  "files": [
    {
      "content_hash": "sha1:da21dc4f63570260f626a07c6207178ebf3416fc",
      "diagnostics": [],
      "id": "1aae6d0cbd7a6568c104c279e72116a4f6feb374",
      "language": "kotlin",
      "parser": "tree-sitter-kotlin",
      "path": "Widget.kt",
      "status": "parsed"
    }
  ],
  "metrics": {
    "ambiguous_edges": 0,
    "diagnostics_total": 0,
    "edges_total": 0,
    "failure_buckets": {},
    "files_failed": 0,
    "files_parsed": 1,
    "files_processed": 1,
    "files_skipped": 0,
    "files_total": 1,
    "graph_failures": 0,
    "metadata_failures": 0,
    "nodes_total": 4,
    "parse_failures": 0,
    "resolved_edges": 0,
    "serialization_failures": 0,
    "unresolved_edges": 0
  },
  "nodes": [
    {
      "definition_id": "4c571ad7d112f80b2a26511e73a9018a715d756f",
      "file_id": "1aae6d0cbd7a6568c104c279e72116a4f6feb374",
      "id": "4c571ad7d112f80b2a26511e73a9018a715d756f",
      "identity": {
        "source": "definition_id",
        "value": "4c571ad7d112f80b2a26511e73a9018a715d756f"
      },
      "kind": "method",
      "language": "kotlin",
      "metadata": {
        "dependencies": [],
        "exports": [],
        "imports": [],
        "parent_symbol": null,
        "semantic_text": "language: kotlin\nfile: Widget.kt\nkind: method\nsymbol: render\nqualified name: render\nsemantic path: Widget.kt::render\nsignature text: render() -> Int\ncontent:\nfun render(): Int {\n        return helper(count)\n    }"
      },
      "node_id": "b48289f2ab3eefda09dad57524efdd41fad4a68f",
      "parent": "e9f6ac3cfcd55046c251b376c932b7cbe35f060f",
      "path": "Widget.kt",
      "provenance": {
        "extractor": "chunk_file",
        "metadata": "retrieval"
      },
      "qualified_name": "render",
      "relationships": [],
      "semantic_path": "Widget.kt::render",
      "signature": "render() -> Int",
      "span": {
        "byte_end": 102,
        "byte_start": 48,
        "end_line": 6,
        "start_line": 4
      },
      "symbol": "render",
      "symbol_id": "4abe85157b48f6dbeca6bed7bb8ddd67ff09e358"
    },
    {
      "definition_id": "cc0a6e60f1c7360be23cdadf259175c7a60625a6",
      "file_id": "1aae6d0cbd7a6568c104c279e72116a4f6feb374",
      "id": "cc0a6e60f1c7360be23cdadf259175c7a60625a6",
      "identity": {
        "source": "definition_id",
        "value": "cc0a6e60f1c7360be23cdadf259175c7a60625a6"
      },
      "kind": "method",
      "language": "kotlin",
      "metadata": {
        "dependencies": [],
        "exports": [],
        "imports": [],
        "parent_symbol": null,
        "semantic_text": "language: kotlin\nfile: Widget.kt\nkind: method\nsymbol: helper\nqualified name: helper\nsemantic path: Widget.kt::helper\nsignature text: helper(value: Int) -> Int\ncontent:\nfun helper(value: Int): Int {\n        return value + 1\n    }"
      },
      "node_id": "d30f63ef3b0f1b5fa660e42a74ac148a40a113d2",
      "parent": "e9f6ac3cfcd55046c251b376c932b7cbe35f060f",
      "path": "Widget.kt",
      "provenance": {
        "extractor": "chunk_file",
        "metadata": "retrieval"
      },
      "qualified_name": "helper",
      "relationships": [],
      "semantic_path": "Widget.kt::helper",
      "signature": "helper(value: Int) -> Int",
      "span": {
        "byte_end": 168,
        "byte_start": 108,
        "end_line": 10,
        "start_line": 8
      },
      "symbol": "helper",
      "symbol_id": "fb1b0a90a3854b49c0ad54f02573825de0a3de8a"
    },
    {
      "definition_id": "f16906df0adc4ed69aa8f61caff4bde67ad2e62e",
      "file_id": "1aae6d0cbd7a6568c104c279e72116a4f6feb374",
      "id": "f16906df0adc4ed69aa8f61caff4bde67ad2e62e",
      "identity": {
        "source": "definition_id",
        "value": "f16906df0adc4ed69aa8f61caff4bde67ad2e62e"
      },
      "kind": "function",
      "language": "kotlin",
      "metadata": {
        "dependencies": [],
        "exports": [],
        "imports": [],
        "parent_symbol": null,
        "semantic_text": "language: kotlin\nfile: Widget.kt\nkind: function\nsymbol: run\nqualified name: run\nsemantic path: Widget.kt::run\nsignature text: run() -> Int\ncontent:\nfun run(): Int {\n    return Widget(1).render()\n}"
      },
      "node_id": "39b82a02da9c326f4b6a0929e89d134adbef20a7",
      "parent": null,
      "path": "Widget.kt",
      "provenance": {
        "extractor": "chunk_file",
        "metadata": "retrieval"
      },
      "qualified_name": "run",
      "relationships": [],
      "semantic_path": "Widget.kt::run",
      "signature": "run() -> Int",
      "span": {
        "byte_end": 220,
        "byte_start": 172,
        "end_line": 15,
        "start_line": 13
      },
      "symbol": "run",
      "symbol_id": "0d672d20cc9e9c350a1b1f5954058b78ade68238"
    },
    {
      "definition_id": "fa65b306cfa8a20c256934715ee62d31f0acef19",
      "file_id": "1aae6d0cbd7a6568c104c279e72116a4f6feb374",
      "id": "fa65b306cfa8a20c256934715ee62d31f0acef19",
      "identity": {
        "source": "definition_id",
        "value": "fa65b306cfa8a20c256934715ee62d31f0acef19"
      },
      "kind": "class",
      "language": "kotlin",
      "metadata": {
        "dependencies": [],
        "exports": [],
        "imports": [],
        "parent_symbol": null,
        "semantic_text": "language: kotlin\nfile: Widget.kt\nkind: class\nsemantic path: Widget.kt\ncontent:\nclass Widget(val count: Int) {\n    fun render(): Int {\n        return helper(count)\n    }\n\n    fun helper(value: Int): Int {\n        return value + 1\n    }\n}"
      },
      "node_id": "e9f6ac3cfcd55046c251b376c932b7cbe35f060f",
      "parent": null,
      "path": "Widget.kt",
      "provenance": {
        "extractor": "chunk_file",
        "metadata": "retrieval"
      },
      "qualified_name": null,
      "relationships": [],
      "semantic_path": "Widget.kt",
      "signature": null,
      "span": {
        "byte_end": 170,
        "byte_start": 13,
        "end_line": 11,
        "start_line": 3
      },
      "symbol": null,
      "symbol_id": null
    }
  ],
  "run": {
    "canonical": true,
    "created_at": null,
    "options": {
      "fail_fast": false,
      "include_retrieval_metadata": true,
      "include_timings": false,
      "language": "kotlin",
      "resolution_mode": "strict"
    },
    "root": "tests/fixtures/boundary_ir/repos/kotlin",
    "timings": {
      "graph_assembly_ms": null,
      "metadata_normalization_ms": null,
      "parse_ms": null,
      "resolution_ms": null,
      "serialization_ms": null,
      "total_ms": null
    },
    "tool": "treesitter-chunker",
    "tool_version": "<tool-version>"
  },
  "schema_version": "3.0",
  "source": {
    "kind": "repository",
    "path": "tests/fixtures/boundary_ir/repos/kotlin"
  }
}
